{
  "inventoryVersion": "2026-08-29.2",
  "generatedFrom": [
    {
      "source": "arch extra/multilib",
      "role": "Compatibility pass 2026-08-29.2: mesa, vulkan loader/drivers, VM guest agents, firmware, laptop sensors and fonts, each name verified against the live pacman sync database."
    },
    {
      "source": "Definitive Frost-OS/omarchy",
      "commit": "0ae1694830b6",
      "role": "Donor base and other package lists (install/omarchy-base.packages, install/omarchy-other.packages). Evidence only."
    },
    {
      "source": "Definitive Frost-OS/omarchy-iso",
      "commit": "268bac16d351",
      "role": "Donor ISO archinstall.packages, the minimal pacstrap set. Evidence only."
    },
    {
      "source": "Frost-OS",
      "commit": "f4a8cc9cd413",
      "role": "Earlier Nix package/option lists, cross-checked for anything unique. Evidence only."
    },
    {
      "source": "frost-pkgs/pkgbuilds/frost/PKGBUILD",
      "role": "The depends() array: every executable the Frost shell and CLI actually call."
    }
  ],
  "categories": [
    "BOOTSTRAP",
    "CORE",
    "DESKTOP",
    "HARDWARE",
    "OPTIONAL",
    "DEVELOPMENT",
    "DROP"
  ],
  "features": {
    "bluetooth": {
      "label": "Bluetooth",
      "description": "Bluetooth stack and management tools. The island Bluetooth panel needs this.",
      "default": true,
      "packages": [
        "bluez",
        "bluez-utils",
        "bluez-tools"
      ]
    },
    "printing": {
      "label": "Printing",
      "description": "CUPS print server, network printer discovery and a setup GUI.",
      "default": false,
      "packages": [
        "cups",
        "cups-browsed",
        "cups-filters",
        "cups-pdf",
        "system-config-printer"
      ]
    },
    "input-method": {
      "label": "Input method (CJK)",
      "description": "Fcitx5 input method framework for Chinese, Japanese, Korean and compose-heavy layouts.",
      "default": false,
      "packages": [
        "fcitx5",
        "fcitx5-gtk",
        "fcitx5-qt",
        "noto-fonts-cjk"
      ]
    },
    "development": {
      "label": "Development tools",
      "description": "Containers, compilers, language runtimes and terminal Git/Docker UIs.",
      "default": false,
      "packages": [
        "docker",
        "docker-buildx",
        "docker-compose",
        "lazydocker",
        "lazygit",
        "clang",
        "llvm",
        "mise-bin",
        "tree-sitter-cli",
        "ruby",
        "lua51",
        "luarocks",
        "libyaml",
        "dotnet-runtime",
        "python-poetry-core",
        "postgresql-libs",
        "mariadb-libs",
        "autoconf-archive",
        "usage",
        "ufw-docker"
      ]
    },
    "gaming": {
      "label": "Gaming",
      "description": "32-bit GPU drivers and a game streaming client. Steam and launchers are installed per-title from the terminal.",
      "default": false,
      "packages": [
        "moonlight-qt",
        "lib32-mesa",
        "lib32-vulkan-radeon",
        "lib32-vulkan-intel",
        "lib32-nvidia-utils",
        "lib32-nvidia-580xx-utils"
      ]
    },
    "scanning": {
      "label": "Scanning",
      "description": "Document scanner support, including driverless network and USB scanners.",
      "default": false,
      "packages": [
        "sane",
        "sane-airscan"
      ]
    },
    "virtualisation-guest": {
      "label": "Run as a VM guest",
      "description": "Guest agents so Frost integrates with its host when it runs inside QEMU/KVM, SPICE, VMware or VirtualBox.",
      "default": false,
      "packages": [
        "qemu-guest-agent",
        "spice-vdagent",
        "open-vm-tools",
        "virtualbox-guest-utils"
      ]
    },
    "media-production": {
      "label": "Media production",
      "description": "Screen recording, streaming and video editing.",
      "default": false,
      "packages": [
        "obs-studio",
        "kdenlive",
        "gpu-screen-recorder",
        "pipewire-jack"
      ]
    },
    "tailscale": {
      "label": "Tailscale",
      "description": "Mesh VPN. The shell only shows the Tailscale control when this is on.",
      "default": false,
      "packages": [
        "tailscale"
      ]
    },
    "aur": {
      "label": "AUR access",
      "description": "An AUR helper and terminal package browsers. The hardened AUR build flow lands in Phase 6; this only installs the tools.",
      "default": true,
      "packages": [
        "paru",
        "yay",
        "pacsea-bin",
        "parui"
      ]
    }
  },
  "profiles": {
    "minimal": {
      "label": "Minimal",
      "description": "Boot, session, audio, network, security and recovery. No desktop applications.",
      "includeCategories": [
        "BOOTSTRAP",
        "CORE"
      ],
      "features": []
    },
    "desktop": {
      "label": "Desktop",
      "description": "The full Frost desktop: everything in Minimal plus the recommended application set.",
      "includeCategories": [
        "BOOTSTRAP",
        "CORE",
        "DESKTOP"
      ],
      "features": [
        "bluetooth",
        "aur"
      ]
    },
    "developer": {
      "label": "Developer",
      "description": "The Desktop profile plus the development toolchain and container stack.",
      "includeCategories": [
        "BOOTSTRAP",
        "CORE",
        "DESKTOP",
        "DEVELOPMENT"
      ],
      "features": [
        "bluetooth",
        "aur",
        "development"
      ]
    }
  },
  "packages": [
    {
      "name": "alsa-firmware",
      "source": "arch",
      "category": "BOOTSTRAP",
      "default": "recommended",
      "reason": "Firmware for some ALSA audio hardware"
    },
    {
      "name": "amd-ucode",
      "source": "arch",
      "category": "BOOTSTRAP",
      "default": "recommended",
      "reason": "AMD CPU microcode updates loaded at boot",
      "hardware": [
        "cpu-amd"
      ],
      "sizeKib": 602
    },
    {
      "name": "base",
      "source": "arch",
      "category": "BOOTSTRAP",
      "default": "required",
      "reason": "Core Arch system group; the floor every package sits on"
    },
    {
      "name": "base-devel",
      "source": "arch",
      "category": "BOOTSTRAP",
      "default": "required",
      "reason": "Build toolchain for makepkg and any local or AUR build"
    },
    {
      "name": "btrfs-progs",
      "source": "arch",
      "category": "BOOTSTRAP",
      "default": "required",
      "reason": "Btrfs tooling; Frost installs on Btrfs for snapshots",
      "sizeKib": 6912
    },
    {
      "name": "dosfstools",
      "source": "arch",
      "category": "BOOTSTRAP",
      "default": "required",
      "reason": "Tools for the FAT EFI system partition",
      "sizeKib": 409
    },
    {
      "name": "efibootmgr",
      "source": "arch",
      "category": "BOOTSTRAP",
      "default": "required",
      "reason": "Creates and edits UEFI boot entries",
      "sizeKib": 83
    },
    {
      "name": "frost-keyring",
      "source": "frost",
      "category": "BOOTSTRAP",
      "default": "required",
      "reason": "Trust anchor for the signed Frost package repository"
    },
    {
      "name": "intel-ucode",
      "source": "arch",
      "category": "BOOTSTRAP",
      "default": "recommended",
      "reason": "Intel CPU microcode updates loaded at boot",
      "hardware": [
        "cpu-intel"
      ]
    },
    {
      "name": "limine",
      "source": "arch",
      "category": "BOOTSTRAP",
      "default": "required",
      "reason": "The bootloader Frost uses",
      "sizeKib": 5232
    },
    {
      "name": "limine-mkinitcpio-hook",
      "source": "arch",
      "category": "BOOTSTRAP",
      "default": "required",
      "reason": "Keeps Limine entries in sync on kernel changes",
      "sizeKib": 19630
    },
    {
      "name": "linux",
      "source": "arch",
      "category": "BOOTSTRAP",
      "default": "required",
      "reason": "The Linux kernel",
      "sizeKib": 151265
    },
    {
      "name": "linux-firmware",
      "source": "arch",
      "category": "BOOTSTRAP",
      "default": "required",
      "reason": "Firmware blobs the kernel loads for common devices"
    },
    {
      "name": "linux-headers",
      "source": "arch",
      "category": "BOOTSTRAP",
      "default": "recommended",
      "reason": "Kernel headers, required to build any DKMS module"
    },
    {
      "name": "mkinitcpio",
      "source": "arch",
      "category": "BOOTSTRAP",
      "default": "required",
      "reason": "Builds the initramfs that boots the system"
    },
    {
      "name": "sof-firmware",
      "source": "arch",
      "category": "BOOTSTRAP",
      "default": "recommended",
      "reason": "Sound Open Firmware for modern Intel and AMD audio DSPs",
      "sizeKib": 43827
    },
    {
      "name": "alsa-ucm-conf",
      "source": "arch",
      "category": "CORE",
      "default": "recommended",
      "reason": "Use-case profiles many modern laptop audio codecs need to route correctly"
    },
    {
      "name": "alsa-utils",
      "source": "arch",
      "category": "CORE",
      "default": "recommended",
      "reason": "alsamixer and card tools for debugging audio",
      "sizeKib": 2529
    },
    {
      "name": "avahi",
      "source": "arch",
      "category": "CORE",
      "default": "recommended",
      "reason": "mDNS and DNS-SD for local names and printer discovery",
      "sizeKib": 2088
    },
    {
      "name": "brightnessctl",
      "source": "arch",
      "category": "CORE",
      "default": "required",
      "reason": "Backlight control the shell OSD calls",
      "sizeKib": 28
    },
    {
      "name": "cliphist",
      "source": "arch",
      "category": "CORE",
      "default": "required",
      "reason": "Clipboard history store the shell reads",
      "sizeKib": 2365
    },
    {
      "name": "coreutils",
      "source": "arch",
      "category": "CORE",
      "default": "required",